{
  "$schema": "./registry.schema.json",
  "schemaVersion": 1,
  "name": "iHub Official Plugins",
  "homepage": "https://github.com/neko233-com/ihub",
  "source": {
    "repository": "https://github.com/neko233-com/ihub",
    "path": "plugins/registry.json"
  },
  "packages": [
    {
      "id": "ihub-plugin-ocr",
      "name": "OCR",
      "description": "Offline Windows x64 OCR. Launcher image/file handoff carries metadata only; recognition still requires an explicit user-selected PNG, JPG, or JPEG.",
      "icon": "icons/ocr.svg",
      "source": {
        "type": "git",
        "url": "https://github.com/neko233-com/ihub-plugin-ocr",
        "defaultRef": "v0.2.1",
        "manifest": "plugin.json"
      },
      "channels": { "stable": "v0.2.1" },
      "supportedTargets": ["windows-x86_64"],
      "capabilities": ["filesystem.read", "clipboard.write", "nativeApi", "launcherContext.files", "launcherContext.image"],
      "status": "available"
    },
    {
      "id": "ihub-plugin-translate",
      "name": "Translate",
      "description": "Consent-first translation through a user-selected LibreTranslate-compatible HTTPS endpoint; explicit launcher text is only prefilled and is never sent automatically.",
      "icon": "icons/translate.svg",
      "source": {
        "type": "git",
        "url": "https://github.com/neko233-com/ihub-plugin-translate",
        "defaultRef": "v1.1.0",
        "manifest": "plugin.json"
      },
      "channels": { "stable": "v1.1.0" },
      "supportedTargets": ["windows-x86_64", "windows-aarch64", "darwin-x86_64", "darwin-aarch64"],
      "capabilities": ["network", "clipboard.write", "launcherContext.text"],
      "status": "available"
    },
    {
      "id": "ihub-plugin-colorpick",
      "name": "Color Picker",
      "description": "Offline color conversion plus a host-confirmed, one-shot system pixel sample that never exposes cursor coordinates or screenshots.",
      "icon": "icons/colorpick.svg",
      "source": {
        "type": "git",
        "url": "https://github.com/neko233-com/ihub-plugin-colorpick",
        "defaultRef": "v1.1.0",
        "manifest": "plugin.json"
      },
      "channels": { "stable": "v1.1.0" },
      "supportedTargets": ["windows-x86_64", "windows-aarch64", "darwin-x86_64", "darwin-aarch64"],
      "capabilities": ["clipboard.write", "cursorColor"],
      "status": "available"
    },
    {
      "id": "ihub-plugin-clipboard",
      "name": "Clipboard History",
      "description": "Consent-first local text collection: capture the current clipboard only on request, then pin, search, and reuse it; optionally load a read-only opt-in iHub history snapshot.",
      "icon": "icons/clipboard.svg",
      "source": {
        "type": "git",
        "url": "https://github.com/neko233-com/ihub-plugin-clipboard",
        "defaultRef": "v1.0.1",
        "manifest": "plugin.json"
      },
      "channels": { "stable": "v1.0.1" },
      "supportedTargets": ["windows-x86_64", "windows-aarch64", "darwin-x86_64", "darwin-aarch64"],
      "capabilities": ["clipboard.read", "clipboard.write", "clipboard.history"],
      "status": "available"
    },
    {
      "id": "ihub-plugin-screenshot",
      "name": "Screenshot",
      "description": "User-initiated browser getDisplayMedia capture of one selected screen, window, or tab frame as PNG; no native capture or global hotkey.",
      "icon": "icons/screenshot.svg",
      "source": {
        "type": "git",
        "url": "https://github.com/neko233-com/ihub-plugin-screenshot",
        "defaultRef": "v1.0.1",
        "manifest": "plugin.json"
      },
      "channels": { "stable": "v1.0.1" },
      "supportedTargets": ["windows-x86_64", "windows-aarch64", "darwin-x86_64", "darwin-aarch64"],
      "capabilities": ["screenCapture", "clipboard.write"],
      "status": "available"
    },
    {
      "id": "ihub-plugin-image-tools",
      "name": "Image Tools",
      "description": "Offline batch image conversion. Launcher file/image handoff carries metadata only; pixels are processed only after explicit re-selection or drop.",
      "source": {
        "type": "git",
        "url": "https://github.com/neko233-com/ihub-plugin-image-tools",
        "defaultRef": "v1.1.0",
        "manifest": "plugin.json"
      },
      "channels": { "stable": "v1.1.0" },
      "supportedTargets": ["windows-x86_64", "windows-aarch64", "darwin-x86_64", "darwin-aarch64"],
      "capabilities": ["launcherContext.files", "launcherContext.image"],
      "status": "available"
    },
    {
      "id": "ihub-plugin-json-tools",
      "name": "JSON Tools",
      "description": "Self-contained offline JSON formatting, minification, validation, and copy tools; published as a pinned TypeScript source package.",
      "source": {
        "type": "git",
        "url": "https://github.com/neko233-com/ihub-plugin-json-tools",
        "defaultRef": "v1.0.1",
        "manifest": "plugin.json"
      },
      "channels": { "stable": "v1.0.1" },
      "supportedTargets": ["windows-x86_64", "windows-aarch64", "darwin-x86_64", "darwin-aarch64"],
      "capabilities": ["clipboard.write"],
      "status": "available"
    },
    {
      "id": "ihub-plugin-text-tools",
      "name": "Text Tools",
      "description": "Offline UUID, SHA-256, Base64, URL, case conversion, and whitespace cleanup; explicit launcher text is only prefilled.",
      "source": {
        "type": "git",
        "url": "https://github.com/neko233-com/ihub-plugin-text-tools",
        "defaultRef": "v1.1.0",
        "manifest": "plugin.json"
      },
      "channels": { "stable": "v1.1.0" },
      "supportedTargets": ["windows-x86_64", "windows-aarch64", "darwin-x86_64", "darwin-aarch64"],
      "capabilities": ["clipboard.write", "launcherContext.text"],
      "status": "available"
    },
    {
      "id": "ihub-plugin-base-converter",
      "name": "Base Converter",
      "description": "Offline BigInt-safe binary, octal, decimal, hexadecimal, and UTF-8/Base64 conversion.",
      "icon": "icons/base-converter.svg",
      "source": {
        "type": "git",
        "url": "https://github.com/neko233-com/ihub-plugin-base-converter",
        "defaultRef": "v1.0.0",
        "manifest": "plugin.json"
      },
      "channels": { "stable": "v1.0.0" },
      "supportedTargets": ["windows-x86_64", "windows-aarch64", "darwin-x86_64", "darwin-aarch64"],
      "capabilities": ["clipboard.write"],
      "status": "available"
    },
    {
      "id": "ihub-plugin-quick-note",
      "name": "Quick Note",
      "description": "Capture, pin, search, copy, and delete notes stored only in plugin-scoped local settings.",
      "icon": "icons/quick-note.svg",
      "source": {
        "type": "git",
        "url": "https://github.com/neko233-com/ihub-plugin-quick-note",
        "defaultRef": "v1.0.0",
        "manifest": "plugin.json"
      },
      "channels": { "stable": "v1.0.0" },
      "supportedTargets": ["windows-x86_64", "windows-aarch64", "darwin-x86_64", "darwin-aarch64"],
      "capabilities": ["clipboard.write"],
      "status": "available"
    },
    {
      "id": "ihub-plugin-screen-record",
      "name": "Screen Recorder",
      "description": "Self-contained local WebM recorder; requests display sharing and optional microphone access only after the user starts, then stops at 30 minutes or 512 MiB.",
      "icon": "icons/screen-record.svg",
      "source": {
        "type": "git",
        "url": "https://github.com/neko233-com/ihub-plugin-screen-record",
        "defaultRef": "v1.0.4",
        "manifest": "plugin.json"
      },
      "channels": { "stable": "v1.0.4" },
      "supportedTargets": ["windows-x86_64", "windows-aarch64", "darwin-x86_64", "darwin-aarch64"],
      "capabilities": ["screenCapture", "microphone"],
      "status": "available"
    },
    {
      "id": "ihub-plugin-batch-rename",
      "name": "Batch Rename",
      "description": "Preview and safely apply filename rules inside one user-selected folder; launcher file handoff carries metadata only and never grants paths.",
      "icon": "icons/batch-rename.svg",
      "source": {
        "type": "git",
        "url": "https://github.com/neko233-com/ihub-plugin-batch-rename",
        "defaultRef": "v1.1.0",
        "manifest": "plugin.json"
      },
      "channels": { "stable": "v1.1.0" },
      "supportedTargets": ["windows-x86_64", "windows-aarch64", "darwin-x86_64", "darwin-aarch64"],
      "capabilities": ["filesystem.read", "filesystem.write", "clipboard.write", "launcherContext.files"],
      "status": "available"
    },
    {
      "id": "ihub-plugin-qrcode",
      "name": "QR Code",
      "description": "Self-contained offline text and URL QR generator with a local PNG preview and download.",
      "icon": "icons/qrcode.svg",
      "source": {
        "type": "git",
        "url": "https://github.com/neko233-com/ihub-plugin-qrcode",
        "defaultRef": "v1.0.0",
        "manifest": "plugin.json"
      },
      "channels": { "stable": "v1.0.0" },
      "supportedTargets": ["windows-x86_64", "windows-aarch64", "darwin-x86_64", "darwin-aarch64"],
      "capabilities": ["clipboard.write"],
      "status": "available"
    },
    {
      "id": "ihub-plugin-developer-tools",
      "name": "Plugin Developer Tools",
      "description": "Create a standalone TypeScript/Vite iHub plugin project beneath a user-selected parent folder.",
      "icon": "icons/developer-tools.svg",
      "source": {
        "type": "git",
        "url": "https://github.com/neko233-com/ihub-plugin-developer-tools",
        "defaultRef": "v1.0.1",
        "manifest": "plugin.json"
      },
      "channels": { "stable": "v1.0.1" },
      "supportedTargets": ["windows-x86_64", "windows-aarch64", "darwin-x86_64", "darwin-aarch64"],
      "capabilities": ["filesystem.read", "filesystem.write"],
      "status": "available"
    },
    {
      "id": "ihub-plugin-window-manager",
      "name": "iHub Window Layout",